{
  "$comment": "Municipios del mapa (índice i = valor de celda en map-grid.json). presence=true: la ROYAT ya tocó ahí. Los demás son clicables para invitar.",
  "states": [
    "Yucatán",
    "Quintana Roo",
    "Campeche"
  ],
  "tours": [
    {
      "label": "Hidalgo y Oaxaca",
      "year": 2026
    }
  ],
  "places": [
    {
      "i": 0,
      "municipio": "Sinanché",
      "label": "Sinanché",
      "state": "Yucatán",
      "presence": false,
      "comisarias": [],
      "colorFamily": -1,
      "labelPos": [
        485.6,
        71.6
      ],
      "stitchOrder": 198.7
    },
    {
      "i": 1,
      "municipio": "Santa Elena",
      "label": "Santa Elena",
      "state": "Yucatán",
      "presence": false,
      "comisarias": [],
      "colorFamily": -1,
      "labelPos": [
        407.8,
        231.4
      ],
      "stitchOrder": 316.4
    },
    {
      "i": 2,
      "municipio": "Dzilam González",
      "label": "Dzilam González",
      "state": "Yucatán",
      "presence": false,
      "comisarias": [],
      "colorFamily": -1,
      "labelPos": [
        551.7,
        65.9
      ],
      "stitchOrder": 133
    },
    {
      "i": 3,
      "municipio": "Abalá",
      "label": "Abalá",
      "state": "Yucatán",
      "presence": false,
      "comisarias": [],
      "colorFamily": -1,
      "labelPos": [
        418.4,
        172.1
      ],
      "stitchOrder": 282.2
    },
    {
      "i": 4,
      "municipio": "Akil",
      "label": "Akil",
      "state": "Yucatán",
      "presence": false,
      "comisarias": [],
      "colorFamily": -1,
      "labelPos": [
        462.6,
        232.2
      ],
      "stitchOrder": 270.3
    },
    {
      "i": 5,
      "municipio": "Baca",
      "label": "Baca",
      "state": "Yucatán",
      "presence": true,
      "comisarias": [],
      "colorFamily": 1,
      "labelPos": [
        455.4,
        94.2
      ],
      "stitchOrder": 229.4
    },
    {
      "i": 6,
      "municipio": "Bokobá",
      "label": "Bokobá",
      "state": "Yucatán",
      "presence": false,
      "comisarias": [],
      "colorFamily": -1,
      "labelPos": [
        489,
        117
      ],
      "stitchOrder": 199.2
    },
    {
      "i": 7,
      "municipio": "Tekom",
      "label": "Tekom",
      "state": "Yucatán",
      "presence": true,
      "comisarias": [],
      "colorFamily": 1,
      "labelPos": [
        602.2,
        195.8
      ],
      "stitchOrder": 144
    },
    {
      "i": 8,
      "municipio": "Sanahcat",
      "label": "Sanahcat",
      "state": "Yucatán",
      "presence": true,
      "comisarias": [],
      "colorFamily": 0,
      "labelPos": [
        483,
        153
      ],
      "stitchOrder": 214.9
    },
    {
      "i": 9,
      "municipio": "Peto",
      "label": "Peto",
      "state": "Yucatán",
      "presence": true,
      "comisarias": [
        "Tixhualatún"
      ],
      "colorFamily": 0,
      "labelPos": [
        539,
        260.4
      ],
      "stitchOrder": 233.6
    },
    {
      "i": 10,
      "municipio": "Opichén",
      "label": "Opichén",
      "state": "Yucatán",
      "presence": false,
      "comisarias": [],
      "colorFamily": -1,
      "labelPos": [
        388.8,
        187.2
      ],
      "stitchOrder": 315.1
    },
    {
      "i": 11,
      "municipio": "Cacalchén",
      "label": "Cacalchén",
      "state": "Yucatán",
      "presence": false,
      "comisarias": [],
      "colorFamily": -1,
      "labelPos": [
        477,
        120
      ],
      "stitchOrder": 211.5
    },
    {
      "i": 12,
      "municipio": "Mayapán",
      "label": "Mayapán",
      "state": "Yucatán",
      "presence": true,
      "comisarias": [],
      "colorFamily": 1,
      "labelPos": [
        487.8,
        193.8
      ],
      "stitchOrder": 228.3
    },
    {
      "i": 13,
      "municipio": "Cansahcab",
      "label": "Cansahcab",
      "state": "Yucatán",
      "presence": true,
      "comisarias": [],
      "colorFamily": 1,
      "labelPos": [
        503.6,
        90.4
      ],
      "stitchOrder": 181.1
    },
    {
      "i": 14,
      "municipio": "Chumayel",
      "label": "Chumayel",
      "state": "Yucatán",
      "presence": true,
      "comisarias": [],
      "colorFamily": 2,
      "labelPos": [
        473.4,
        199.8
      ],
      "stitchOrder": 243.8
    },
    {
      "i": 15,
      "municipio": "Yobaín",
      "label": "Yobaín",
      "state": "Yucatán",
      "presence": false,
      "comisarias": [],
      "colorFamily": -1,
      "labelPos": [
        497,
        72.3
      ],
      "stitchOrder": 187.3
    },
    {
      "i": 16,
      "municipio": "Chikindzonot",
      "label": "Chikindzonot",
      "state": "Yucatán",
      "presence": false,
      "comisarias": [],
      "colorFamily": -1,
      "labelPos": [
        583.2,
        231.2
      ],
      "stitchOrder": 184
    },
    {
      "i": 17,
      "municipio": "Kanasín",
      "label": "Kanasín",
      "state": "Yucatán",
      "presence": true,
      "comisarias": [],
      "colorFamily": 1,
      "labelPos": [
        435,
        132
      ],
      "stitchOrder": 255.1
    },
    {
      "i": 18,
      "municipio": "Hunucmá",
      "label": "Hunucmá",
      "state": "Yucatán",
      "presence": true,
      "comisarias": [
        "Puerto: Sisal"
      ],
      "colorFamily": 0,
      "labelPos": [
        370.1,
        106.1
      ],
      "stitchOrder": 315.4
    },
    {
      "i": 19,
      "municipio": "Dzitás",
      "label": "Dzitás",
      "state": "Yucatán",
      "presence": true,
      "comisarias": [],
      "colorFamily": 2,
      "labelPos": [
        582.4,
        140.1
      ],
      "stitchOrder": 119.6
    },
    {
      "i": 20,
      "municipio": "Chichimilá",
      "label": "Chichimilá",
      "state": "Yucatán",
      "presence": true,
      "comisarias": [],
      "colorFamily": 2,
      "labelPos": [
        633.2,
        204.6
      ],
      "stitchOrder": 137
    },
    {
      "i": 21,
      "municipio": "Chapab",
      "label": "Chapab",
      "state": "Yucatán",
      "presence": false,
      "comisarias": [],
      "colorFamily": -1,
      "labelPos": [
        441.6,
        195
      ],
      "stitchOrder": 269.6
    },
    {
      "i": 22,
      "municipio": "Chankom",
      "label": "Chankom",
      "state": "Yucatán",
      "presence": false,
      "comisarias": [],
      "colorFamily": -1,
      "labelPos": [
        577.4,
        195.7
      ],
      "stitchOrder": 159.4
    },
    {
      "i": 23,
      "municipio": "Celestún",
      "label": "Celestún",
      "state": "Yucatán",
      "presence": false,
      "comisarias": [],
      "colorFamily": -1,
      "labelPos": [
        325.7,
        134.2
      ],
      "stitchOrder": 363
    },
    {
      "i": 24,
      "municipio": "Calotmul",
      "label": "Calotmul",
      "state": "Yucatán",
      "presence": true,
      "comisarias": [
        "Pocoboch"
      ],
      "colorFamily": 3,
      "labelPos": [
        642.6,
        114.6
      ],
      "stitchOrder": 55.8
    },
    {
      "i": 25,
      "municipio": "Valladolid",
      "label": "Valladolid",
      "state": "Yucatán",
      "presence": true,
      "comisarias": [
        "Yalcobá",
        "Ebtún",
        "Tahmuy",
        "Xocén"
      ],
      "colorFamily": 0,
      "labelPos": [
        644.3,
        173.1
      ],
      "stitchOrder": 103.7
    },
    {
      "i": 26,
      "municipio": "Umán",
      "label": "Umán",
      "state": "Yucatán",
      "presence": true,
      "comisarias": [
        "Oxholón",
        "Yaxcopoil",
        "Bolón"
      ],
      "colorFamily": 1,
      "labelPos": [
        402.3,
        141.3
      ],
      "stitchOrder": 289.1
    },
    {
      "i": 27,
      "municipio": "Cantamayec",
      "label": "Cantamayec",
      "state": "Yucatán",
      "presence": false,
      "comisarias": [],
      "colorFamily": -1,
      "labelPos": [
        507.3,
        206.1
      ],
      "stitchOrder": 218.8
    },
    {
      "i": 28,
      "municipio": "Cenotillo",
      "label": "Cenotillo",
      "state": "Yucatán",
      "presence": true,
      "comisarias": [
        "Tixbacab"
      ],
      "colorFamily": 0,
      "labelPos": [
        575.5,
        111.4
      ],
      "stitchOrder": 113.9
    },
    {
      "i": 29,
      "municipio": "Conkal",
      "label": "Conkal",
      "state": "Yucatán",
      "presence": true,
      "comisarias": [],
      "colorFamily": 1,
      "labelPos": [
        439.5,
        103.5
      ],
      "stitchOrder": 246.1
    },
    {
      "i": 30,
      "municipio": "Sudzal",
      "label": "Sudzal",
      "state": "Yucatán",
      "presence": false,
      "comisarias": [],
      "colorFamily": -1,
      "labelPos": [
        529.8,
        147.4
      ],
      "stitchOrder": 169.5
    },
    {
      "i": 31,
      "municipio": "Sotuta",
      "label": "Sotuta",
      "state": "Yucatán",
      "presence": false,
      "comisarias": [],
      "colorFamily": -1,
      "labelPos": [
        517.3,
        178.1
      ],
      "stitchOrder": 194.9
    },
    {
      "i": 32,
      "municipio": "Seyé",
      "label": "Seyé",
      "state": "Yucatán",
      "presence": false,
      "comisarias": [],
      "colorFamily": -1,
      "labelPos": [
        459,
        142.2
      ],
      "stitchOrder": 234.3
    },
    {
      "i": 33,
      "municipio": "Cuzamá",
      "label": "Cuzamá",
      "state": "Yucatán",
      "presence": false,
      "comisarias": [],
      "colorFamily": -1,
      "labelPos": [
        462.6,
        160.2
      ],
      "stitchOrder": 236.6
    },
    {
      "i": 34,
      "municipio": "Chacsinkín",
      "label": "Chacsinkín",
      "state": "Yucatán",
      "presence": false,
      "comisarias": [],
      "colorFamily": -1,
      "labelPos": [
        510.6,
        244.2
      ],
      "stitchOrder": 240.7
    },
    {
      "i": 35,
      "municipio": "Chocholá",